,title,brand,descript,url,time
0,A physician's Mother's Day gift: reclaimed time with my children — and for myself,STAT,"The holiday encourages us to honor the sacrifices mothers make to care for their families. I hope physician-mothers, especially those most at risk for time...11 months ago",https://www.statnews.com/2023/05/12/physician-mothers-day-gift-children/,11 months ago
1,40 Best Mother's Day Gifts for Mom 2024 | The Strategist,New York Magazine,"For the mom who plans hiking trips ... If she's been hitting the trail without one, Mom will surely appreciate having a LifeStraw in her kit, especially on longer...2 days ago",https://nymag.com/strategist/article/best-mothers-day-gifts-for-mom.html,2 days ago
2,47 Best Mother’s Day Gifts for Every Type of Mom 2024,Glamour,"The best Mother's Day gifts, at a glance · Best Flower Delivery: UrbanStems Flower Subscription, $55 · Best Luxury Mother's Day Gift: Lunya Washable Silk Robe,...5 days ago",https://www.glamour.com/gallery/best-mothers-day-gifts-online,5 days ago
3,60 Unique Mother's Day Gifts for Mom - 2024,Oprah Daily,60 Unique Mother's Day Gifts for Every Type of Mom · Uncommon Goods Birth Month Flower Grow Kit · Uncommon Goods Birth Month Flower Grow Kit · Eyp Publishing...4 days ago,https://www.oprahdaily.com/life/g31400004/unique-mothers-day-gifts/,4 days ago
4,41 best Mother's Day gifts for mom in 2024,NBC News,"41 best Mother's Day 2024 gifts: Home goods, tech and more · Mother's Day gift ideas in 2024 · Personalized gifts · L.L.Bean Boat and Tote Zip-Top · Artifact...3 days ago",https://www.nbcnews.com/select/shopping/best-mothers-day-gifts-mom-ncna1304145,3 days ago
5,Mother’s Day Gift Idea — Cookbook for Mother’s Day,Apartment Therapy,Learn why one writer gives her mom a cookbook for a Mother's Day present — and buys one for herself.11 months ago,https://www.apartmenttherapy.com/cookbook-mothers-day-gift-37251310,11 months ago
6,Best Mother's Day gifts for new moms,CBS News,"It's her first Mother's Day and you need to gift her something special. She's delivered the most important gift, a gorgeous little baby, and now you want to...1 week ago",https://www.cbsnews.com/essentials/mothers-day-gifts-for-new-moms/,1 week ago
7,Why I'm Skipping Mother's Day,The Atlantic,"The best Mother's Day gift I ever received was not from my children. In May 2020, at the height of the pandemic, an anonymous plain brown package arrived in...11 months ago",https://www.theatlantic.com/ideas/archive/2023/05/mothersdayholidayskipping/674057/,11 months ago
8,24 Mother's Day Gifts We've Tried and Love (2023),WIRED,24 Mother's Day Gift Ideas for the Superhero in Your Life · A New Pair of Headphones. Creative Aurvana Ace 2 · A Chocolate Bouquet. Bokksu Chocolate Bouquet.1 day ago,https://www.wired.com/gallery/best-mothers-day-gifts-2024/,1 day ago
9,Mother's Day Gift Ideas From Talbots,Daily Front Row,"Mother's Day is coming up fast—and Talbots has it all. From seasonal updates like stylish summer dresses, sandals, lightweight suiting,...11 months ago",https://fashionweekdaily.com/mothers-day-gift-ideas-from-talbots/,11 months ago
10,Why I'm Skipping Mother's Day,The Atlantic,"The best Mother's Day gift I ever received was not from my children. In May 2020, at the height of the pandemic, an anonymous plain brown package arrived in...11 months ago",https://www.theatlantic.com/ideas/archive/2023/05/mothersdayholidayskipping/674057/,11 months ago
11,24 Mother's Day Gifts We've Tried and Love (2023),WIRED,24 Mother's Day Gift Ideas for the Superhero in Your Life · A New Pair of Headphones. Creative Aurvana Ace 2 · A Chocolate Bouquet. Bokksu Chocolate Bouquet.1 day ago,https://www.wired.com/gallery/best-mothers-day-gifts-2024/,1 day ago
12,"34 Best Mother’s Day Gifts to Give Mom in 2024, Starting at $65",Vogue,Ensure all the moms in your life feel appreciated by shopping Vogue's guide to the very best Mother's Day gifts of 2024.2 weeks ago,https://www.vogue.com/slideshow/best-mothers-day-gifts,2 weeks ago
13,47 Best Mother's Day Gifts for Every Kind of Mom,The Cut,"For the mom who needs to wind down ... All moms deserve a relaxation session, and this bath oil is like bottled box breathing. It's formulated to target the vagus...11 months ago",https://www.thecut.com/article/best-mothers-day-gifts.html,11 months ago
14,48 Best Mother's Day Gifts for Most Every Kind of Mom in 2024,CNET,Soundcore Motion 200 wireless Bluetooth speaker ($70) · Anker Eufy 25C robot vacuum ($149) · Nebula Mars 3 Air portable projector ($500)...1 week ago,https://www.cnet.com/home/best-mothers-day-gifts/,1 week ago
15,Best Mother's Day Gifts for Someone with Diabetes,diaTribe.org,No less than the American Diabetes Association says medical ID jewelry can save your life. For someone experiencing low blood sugar (particularly those who have...11 months ago,https://diatribe.org/best-mothers-day-gifts-for-someone-with-diabetes,11 months ago
16,30 Best Mother's Day Gifts for Cyclists 2023 - Cycling Gifts for Moms,Bicycling,"Park Tool IB-3 I-Beam Multitool ... This handy multitool is ideal for cyclists who need to pack light and stay safe. This gadget has 3-, 4-, 5-, 6-, and 8-mm hex...11 months ago",https://www.bicycling.com/bikes-gear/g39828540/mothers-day-gifts-for-cyclists/,11 months ago
17,All of the Best Mother's Day Gift Ideas,New York Magazine,"We've collected all of the best Mother's Day gift ideas here — including the best gifts for any type of mom (or grandma), best gifts for new moms,...2 days ago",https://nymag.com/strategist/article/best-mothers-day-gift-ideas.html,2 days ago
18,80 Best Gifts for Mom of 2024: Birthday Gift Ideas for Mother,Oprah Daily,"Whether you're celebrating her birthday, Mother's Day, or the holidays, these are the best gifts for mom, from the luxurious to the useful.1 month ago",https://www.oprahdaily.com/life/relationships-love/g26788572/gifts-for-mom/,1 month ago
19,The best Mother's Day gifts under $100 will delight every kind of mom,CBS News,"Show Mom how much you care with one of these gifts, all handpicked for mothers of all stripes and less than $100.6 days ago",https://www.cbsnews.com/essentials/best-mothers-day-gifts-under-100/,6 days ago
20,Best last minute Mother's Day gifts that arrive by Sunday,CBS News,Best last minute Mother's Day gifts that arrive by Sunday · Amazon Mother's Day e-gift card free money deal · Apple Watch 8 · Apple AirPods Pro 2 · Barefoot...11 months ago,https://www.cbsnews.com/essentials/best-last-minute-mothers-day-gifts-2023-05-12/,11 months ago
21,Best Last-Minute Mother’s Day Gifts: Shop Now,observer.com,The Best Last-Minute Mother's Day Gift Guide · bottle of red wine. Orin Swift. · gold and white dropped bottle reading eve lom with face oil next to pink gua...11 months ago,https://observer.com/2023/05/mothers-day-gifts-last-minute/,11 months ago
22,The best Mother’s Day gifts for every type of mom,"ABC News - Breaking News, Latest News and Videos",Check out Shop ABC's list of the best Mother's Day gifts for every type of mom.6 days ago,https://abcnews.go.com/Shop/best-mothers-day-gifts/story%3Fid%3D108706078,6 days ago
23,Best Mother's Day Gifts For Your Mother-In-Law 2023,Forbes,Best Mother's Day Gifts For Mother-In-Laws · An Unexpected Upgrade For Her Car · Diptyque Baies Car Diffuser · An Artful Bouquet · Urban Stems The Ellington...11 months ago,https://www.forbes.com/sites/forbes-personal-shopper/2023/05/05/best-mothers-day-gifts-for-mother-in-law/,11 months ago
24,2023 Mother's Day Gift Guide,Cup of Jo,You can pick from packages that have pre-determined pint flavors or build your own. The ice cream comes in a cooler with dry ice so it's safe to be out doors...11 months ago,https://cupofjo.com/2023/05/01/2023-mothers-day-gift-guide/,11 months ago
25,The Best Mother’s Day Gifts For Daughters 2024,Forbes,The Best Mother's Day Gifts For Daughters · An It-Girl Sandal That She'll Wear All Summer · M.Gemi Isa Sandal · A Luxe Cashmere Throw For Cozy Nights In · The...11 months ago,https://www.forbes.com/sites/forbes-personal-shopper/2023/05/05/mothers-day-gifts-for-daughters/,11 months ago
26,7 Mother’s Day Gifts Perfect for Moms in Delaware,Delaware Today,7 Mother's Day Gifts Perfect for Moms in Delaware · Sassy Bee Natural Honey Products · Homesick Candle's Delaware Candle · A Shabby-Chic Delaware-Themed Sign.11 months ago,https://delawaretoday.com/life-style/mothers-day-gifts/,11 months ago
27,33 Mother’s Day gifts from Nordstrom your mom will absolutely love,CNN,33 Mother's Day gifts from Nordstrom your mom will absolutely love · Stanley The Quencher H2. · Nordstrom Modern Waffle Robe · Dyson Supersonic Hair Dryer.11 months ago,https://www.cnn.com/cnn-underscored/gifts/nordstrom-mothers-day-gifts-2023,11 months ago
28,7 Great Mother’s Day Gifts in the Main Line Area,Main Line Today,7 Great Mother's Day Gifts in the Main Line Area · Posh Collections · Plant Roots Local · GP Candle Co. · Primex Garden Center · iRiEVEDA · BABA's Acid Trip.11 months ago,https://mainlinetoday.com/life-style/mothers-day-gifts/,11 months ago
29,The Best Mother's Day Gifts For Grandma That Are (Almost) As Sweet As She Is,Forbes,Best Mother's Day Gifts For Grandma · A Chic Kitchen Upgrade · Smeg Electric Kettle · A Knitting Kit To Make The Comfiest Blanket Ever · The Mellow Blanket...11 months ago,https://www.forbes.com/sites/forbes-personal-shopper/2023/05/10/mothers-day-gifts-for-grandma/,11 months ago
30,Thoughtful Mother's Day Gifts for When You Can't Be There in Person,CNET,"If you live far away and can't take Mom out to brunch, these gifts are the next best thing.4 weeks ago",https://www.cnet.com/home/best-mothers-day-gifts-when-you-cant-be-there-in-person/,4 weeks ago
31,The 29 Best Mother's Day Gifts For Under $25 2024,Refinery29,These Under-$25 Mother's Day Gifts Only Look Expensive · Kate Spade Outlet Pearls Of Wisdom Studs · Utopia Kitchen 34 Ounce French Press Espresso and Tea Maker.2 days ago,https://www.refinery29.com/en-us/cheap-mothers-day-gifts,2 days ago
32,Best Mother's Day Gifts 2024,Forbes,"Best Mother's Day Gifts Overall · A Personalized Necklace To Keep Her Kiddos Close To Heart · Made By Mary Ray Bar Necklace · Cozy Sleepwear, Monogrammed Just...2 weeks ago",https://www.forbes.com/sites/forbes-personal-shopper/2024/04/03/best-mothers-day-gifts/,2 weeks ago
33,The 83 very best Mother's Day gifts for every type of mom in 2024,New York Post,"We rounded up the 83 best Mother's Day gifts of 2024 to spoil your mother, grandmother, aunt, new mom and everyone else on your list.2 days ago",https://nypost.com/shopping/best-mothers-day-gifts-2024/,2 days ago
34,10 Mother's Day Wellness Gifts to Buy From Philly Brands,Philadelphia Magazine,"Get wellness tips, workout trends, healthy eating, and more delivered right to your inbox with our Be Well newsletter. · Bonding over blooms · Partner yoga · A...11 months ago",https://www.phillymag.com/be-well-philly/2023/05/03/mothers-day-wellness-gifts-2023/,11 months ago
35,32 Best Mother's Day Gifts for Sisters in 2024,Good Housekeeping,32 Thoughtful Mother's Day Gifts for Your Sister Who's Also a Mom · Homedics Bubble Mate Foot Spa · Homedics Bubble Mate Foot Spa · Mama and Mini Hats · Mama...1 month ago,https://www.goodhousekeeping.com/holidays/mothers-day/g46890150/mothers-day-gifts-for-sister/,1 month ago
36,A San Antonio Mother's Day Gift Guide,San Antonio Magazine,"Create a custom gift basket just for Mom at this Alamo Heights shop. Throw in candles from Hondo-based Little Light Candle Co. ($14), apothecary items, bespoke...11 months ago",https://www.sanantoniomag.com/a-san-antonio-mothers-day-gift-guide/,11 months ago
37,15 last-minute Mother's Day gifts from Amazon that will arrive on time,USA Today,"If you're shopping for a crafty mom who loves to pick up new skills, a set of professional-grade calligraphy pens could be a great option. For dainty cursive...11 months ago",https://www.usatoday.com/story/money/reviewed/2023/05/04/last-minute-mothers-day-gifts-amazon/70183402007/,11 months ago
38,Texas Mother's Day Local Gift Guide 2023,Texas Monthly,"16 Exceptional Mother's Day Gifts for the Texas Matriarch · A(nother) Cast Iron Skillet · Fancy Coffee, on Repeat · Gourmet Dijon Mustard · Popular Videos · A...11 months ago",https://www.texasmonthly.com/style/mothers-day-gift-guide-2023/,11 months ago
39,"Mother's Day Gift Guide 2024: Shop Flowers, Jewelry and More Mother's Day Gift Ideas for Mom",Entertainment Tonight,"Mother's Day Gift Guide 2024: Shop Flowers, Jewelry and More Mother's Day Gift Ideas for Mom · Treat the mother figure in your life with something they'll...3 days ago",https://www.etonline.com/mothers-day-gift-guide-2024-shop-flowers-jewelry-and-more-mothers-day-gift-ideas-for-mom-221596,3 days ago
40,35 Best Long-Distance Mother's Day Gift - Gifts for Moms Who Live Far Way,Good Housekeeping,Check out personalized and thoughtful long-distance Mother's Day gifts for moms who live for away. There are plenty of mother-daughter and mother-son...1 month ago,https://www.goodhousekeeping.com/holidays/gift-ideas/g60078637/long-distance-mothers-day-gifts/,1 month ago
41,Mother's Day gifts made in RI from woman-owned businesses,The Providence Journal,"Made in Rhode Island by women-owned businesses, these Mother's Day gifts will impress mom · Queen Bean Coffee Sampler · Woosah Tea Bundle · Root for Women...11 months ago",https://www.providencejournal.com/story/entertainment/local/2023/05/04/mothers-day-gifts-made-in-ri-from-woman-owned-businesses-queen-bean-coffee-woosah-tea-root-for-women/70178496007/,11 months ago
42,Last-Minute Mother's Day Gifts She Won't Return,NBC Boston,Last-Minute Mother's Day Gifts She Won't Return · Geranium Punch Needle Pattern. $FREE. · Farmgirl Flowers Burlap Wrapped Boquet. $79-$129. · Dartwood Smart...11 months ago,https://www.nbcboston.com/entertainment/the-scene/last-minute-mothers-day-gifts-she-wont-return/3040072/,11 months ago
43,"30 Cool Mother's Day Gifts to Give in 2024, According to Chic Moms",Vogue,"Your search for the best cool Mother's Day gifts to give stops here. We asked the chicest moms we know to real what they really want, and the list is quite...1 week ago",https://www.vogue.com/article/cool-mothers-day-gifts,1 week ago
44,Thoughtful Mother's Day Gifts for When You Can't Be There in Person,CNET,"If you live far away and can't take Mom out to brunch, these gifts are the next best thing.4 weeks ago",https://www.cnet.com/home/best-mothers-day-gifts-when-you-cant-be-there-in-person/,4 weeks ago
45,The 29 Best Mother's Day Gifts For Under $25 2024,Refinery29,These Under-$25 Mother's Day Gifts Only Look Expensive · Kate Spade Outlet Pearls Of Wisdom Studs · Utopia Kitchen 34 Ounce French Press Espresso and Tea Maker.2 days ago,https://www.refinery29.com/en-us/cheap-mothers-day-gifts,2 days ago
46,Best Mother's Day Gifts 2024,Forbes,"Best Mother's Day Gifts Overall · A Personalized Necklace To Keep Her Kiddos Close To Heart · Made By Mary Ray Bar Necklace · Cozy Sleepwear, Monogrammed Just...2 weeks ago",https://www.forbes.com/sites/forbes-personal-shopper/2024/04/03/best-mothers-day-gifts/,2 weeks ago
47,30 cool Mother's Day gift ideas for every hip mom,TODAY.com,Show your mom she's not a 'regular mom' with these 30 cool Mother's Day gifts · Best cool gifts for Mother's Day · Log Cabin Incense and Burner - Balsam Fir.11 months ago,https://www.today.com/shop/cool-mothers-day-gift-ideas-t253809,11 months ago
48,The 83 very best Mother's Day gifts for every type of mom in 2024,New York Post,"We rounded up the 83 best Mother's Day gifts of 2024 to spoil your mother, grandmother, aunt, new mom and everyone else on your list.2 days ago",https://nypost.com/shopping/best-mothers-day-gifts-2024/,2 days ago
49,10 Mother's Day Wellness Gifts to Buy From Philly Brands,Philadelphia Magazine,"Get wellness tips, workout trends, healthy eating, and more delivered right to your inbox with our Be Well newsletter. · Bonding over blooms · Partner yoga · A...11 months ago",https://www.phillymag.com/be-well-philly/2023/05/03/mothers-day-wellness-gifts-2023/,11 months ago
50,29 Last-Minute Deals on Mother’s Day Gifts (2023),WIRED,"The Carva drops to $149 often, but it holds the title of best overall in our buying guide. It has a high-quality display and unlimited storage, and is super...11 months ago",https://www.wired.com/story/last-minute-mothers-day-deals-2023/,11 months ago
51,30 Best Cheap Mother's Day Gifts under $50 of 2024 | Reviews by Wirecutter,The New York Times,"Our favorite Mother's Day gifts for every budget, from $15 to $25 to $50.1 week ago",https://www.nytimes.com/wirecutter/gifts/best-cheap-mothers-day-gifts/,1 week ago
52,11 best Mother's Day gifts for moms who stay active,CBS Sports,"From premium gear to budget picks she's sure to love, these are the best Mother's Day 2024 gifts for active moms.6 days ago",https://www.cbssports.com/essentials/news/11-best-mothers-day-gifts-for-moms-who-stay-active/,6 days ago
53,15 Mother's Day Gifts to Upgrade Her Life,Shondaland.com,15 Mother's Day Gifts to Upgrade Her Life · Pasta · Pasta · Athleisure · Athleisure · Laser Facial · Laser Facial · Cookware · Cookware. Now 34% Off. $99 at Our...11 months ago,https://www.shondaland.com/live/g43797329/15-mothers-day-gifts-to-upgrade-her-life/,11 months ago
54,38 Mother's Day Gift Ideas If You Don't Know What To Buy,BuzzFeed,"An LED flat plate, cookie bouquet, towel warmer, and other Mother's Day gifts that'll ship fast and be a hit with your mom.11 months ago",https://www.buzzfeed.com/malloryannp/mothers-day-gifts-dont-know-what-to-buy,11 months ago
55,39 last-minute Mother's Day gifts that'll arrive on time,TODAY.com,Forgot to order your Mother's Day gift? Don't worry — we found 39 that'll still make it in time · Last-minute Mother's Day jewelry · Initial Disc Necklace.11 months ago,https://www.today.com/shop/last-minute-mothers-day-gifts-t285000,11 months ago
56,43 Last-Minute Mother's Day Gifts From Amazon,Business Insider,Amarena Fabbri Wild Cherries in Syrup ... Make any dessert feel extra luxurious by drizzling on this century-old Italian candied cherry syrup. Unlike ultra-rich...11 months ago,https://www.businessinsider.com/guides/gifts/last-minute-mothers-day-gifts-amazon-2023,11 months ago
57,Best Mother’s Day Gifts For Wife 2024,Forbes,Best Mother's Day Gifts For Wife Overall · A Super Soft Set Of Pajamas · Cozy Earth Women's Long Sleeve Bamboo Pajama Set · The Ultimate Self-Care Set · Goop...1 week ago,https://www.forbes.com/sites/forbes-personal-shopper/2024/04/05/mothers-day-gifts-for-wife/,1 week ago
58,40 Perfect Mother's Day Gifts For Yourself,BuzzFeed,"4. A glass essential oil diffuser that'll put on a gorgeous light show while it quietly releases a cool, calming mist. You can add your favorite essential oil...11 months ago",https://www.buzzfeed.com/jenae_sitzes/mothers-day-gifts-to-treat-yourself-to,11 months ago
59,Here are 11 must-have local Mother's Day gifts,Hawaii News Now,Here are 11 must-have...11 months ago,https://www.hawaiinewsnow.com/2023/05/08/here-are-11-must-have-local-mothers-day-gifts/,11 months ago
60,The 20 best Mother's Day gifts of 2024,National Geographic,"Some moms want to skip the flowers and breakfast in bed. Instead, they'd rather jet off to an amazing destination. For moms who love to travel, Mother's Day...2 days ago",https://www.nationalgeographic.com/lifestyle/article/mothers-day-gifts,2 days ago
61,25 Mother's Day Gifts to Send Straight to Mom [2023],Taste of Home,25 Mother's Day Gifts to Send Straight to Mom · For the Birder: Ferris Wheel Hummingbird Feeder · For the Gourmet: Herb Garden · For the Flower Fan: The Juliet...8 months ago,https://www.tasteofhome.com/collection/mothers-day-gifts-sent-straight-to-mom/,8 months ago
62,Atlanta's Mara Davis offers Mother's Day gift ideas — besides brunch – WABE,WABE,Atlanta's Mara Davis offers Mother's Day gift ideas — besides brunch · Music: · Reading & Cooking — Two new Atlanta cookbooks: · Flower lessons: · Spa treatment...11 months ago,https://www.wabe.org/atlanta-media-maven-mara-davis-offers-plethora-of-mothers-day-gift-ideas-besides-brunch/,11 months ago
63,The 23 Best-Reviewed Amazon Mother's Day Gifts 2023,Refinery29,The Best Amazon Mother's Day Gifts That Will Arrive On Time · OEAGO Glass Butterfly Rose Red Tea Cup With Spoon Set · Lululemon Everywhere Belt Bag · HOKA ONE...11 months ago,https://www.refinery29.com/en-us/best-amazon-mothers-day-gifts,11 months ago
64,33 Best Mother's Day Gift Ideas—All Tried & Tested 2024,SheKnows,33 Genius Mother's Day Gift Ideas for Literally Every Kind of Mom in Your Life · Top 10 Mother's Day Gift Ideas at Glance · A Quilted Tote Bag · Keurig Coffee...2 weeks ago,https://www.sheknows.com/living/slideshow/5887/mothers-day-gifts/,2 weeks ago
65,17 special Mother's Day gifts for every kind of mom,TODAY.com,Editor-approved Mother's Day gifts for every kind of mom — starting at $7 · Mother's Day bestseller gifts · Mother's Day Tulips Pop-Up Card · Mama Bracelet.3 weeks ago,https://www.today.com/shop/special-mothers-day-gifts-t253617,3 weeks ago
66,On a Budget? Here Are 26 Last-Minute Mother’s Day Gifts Under $100,Billboard,"Tatcha's Dewy Cleanse Hydrate Duo will put you slightly above the $25 limit, but if you can spare an extra $2, this duo makes a nice gift item. It includes...11 months ago",https://www.billboard.com/culture/product-recommendations/the-best-last-minute-mothers-day-gifts-for-every-kind-of-budget-1235065971/,11 months ago
67,31 Best Last Minute Mother's Day Gifts for Every Type of Mom 2023,Town & Country Magazine,Last Minute Mother's Day Gifts That Don't Feel Last Minute · Bouqs Vibrance · Bouqs Vibrance · Masterclass Classes · Masterclass Classes · Anthropologie Tiled...11 months ago,https://www.townandcountrymag.com/style/g27168800/last-minute-mothers-day-gifts/,11 months ago
68,Thoughtful Mother's Day Gifts at Starbucks,Starbucks Stories,"Just in time for Mother's Day, Starbucks is introducing a new collection of beautiful drinkware perfect for any mother figure. The new Mother's Day...5 days ago",https://stories.starbucks.com/press/2024/thoughtful-mothers-day-gifts-at-starbucks/,5 days ago
69,Mother's Day Gift Guide: The Best Wellness And Self-Care Essentials For Travelers,Forbes,"Mother's Day Gift Guide: The Best Wellness And Self-Care Essentials For Travelers · Augustinus Bader The Retinol Serum, $350 · Tivic ClearUP, $249.99 · Robert...11 months ago",https://www.forbes.com/sites/katiechang/2023/04/20/mothers-day-gift-guide-the-best-wellness-and-self-care-essentials-for-traveling-moms/,11 months ago
70,15 Last-Minute Mother's Day Gifts in 2023 You Can Grab Right Now,Allure,15 Last-Minute Mother's Day Gifts That'll Make Her Day · Dr. Dennis Gross Skincare DRx SpectraLite FaceWare Pro · Chanel No. · Our Place Always Pan 2.0.11 months ago,https://www.allure.com/gallery/last-minute-mothers-day-gifts-2023,11 months ago
71,32 Vegan Mother's Day Gift Ideas For Every Kind of Mom,VegNews,32 Vegan Mother's Day Gift Ideas For Every Kind of Mom · 1 Biossance cleansing oil · 2 Coffee bath bomb · 3 Love Beauty and Planet body lotion · 4 Brooklyn...11 months ago,https://vegnews.com/products/vegan-mothers-day-gift-ideas,11 months ago
72,What Mother's Day gifts under $50 are worth it? We went shopping to find out,WVTM,Mother's Day is a special holiday where we share love and appreciation for the mothers in our lives. We've been on the hunt for budget-friendly gift options...1 day ago,https://www.wvtm13.com/article/mothers-day-2024-shopping-under-50-dollars/60481040,1 day ago
73,3 of the Most Common Mother's Day Gifts and Where to Find Them,The Motley Fool,"3 of the Most Common Mother's Day Gifts and Where to Find Them · This year, flowers, greeting cards, and special outings are the most common gifts. · To...11 months ago",https://www.fool.com/the-ascent/personal-finance/articles/3-of-the-most-common-mothers-day-gifts-and-where-to-find-them/,11 months ago
74,35 Best Last-Minute Mother's Day Gift Ideas,The Cut,"A reusable cutlery set. You may have already gifted her metallic straws, but help her ditch plastic flatware for good by gifting her this all-in-one set. Along...11 months ago",https://www.thecut.com/article/best-last-minute-mothers-day-gift-ideas.html,11 months ago
75,Editors’ picks: The 35 best Mother’s Day gifts we’ve ever given and received,CNN,"Getting just the right gift for Mother's Day can feel like a lot of pressure. While we've got plenty of ideas for what to get her, we also have firsthand...11 months ago",https://www.cnn.com/cnn-underscored/gifts/editors-pick-mothers-day-gifts-2023,11 months ago
76,What you're really saying with your Mother's Day gift,The Conversation,"Strengthening the relationship. As we learned from the mothers and daughters in our study, exchanging mundane gifts is a way to confirm a lasting bond,...1 month ago",https://theconversation.com/what-youre-really-saying-with-your-mothers-day-gift-222297,1 month ago
77,9 Last-Minute Mother's Day Gifts She'll Love - EBONY,EBONY,"A new pair of pajamas, a strappy sandal or a new pleated skirt can all make perfect additions to Mom's wardrobe. If your mom is into beauty, Versace fragrances...11 months ago",https://www.ebony.com/9-last-minute-mothers-day-gifts-shell-love/,11 months ago
78,Best Mother's Day gifts at Walmart,CBS News,"Mother's Day 2024 is just around the corner, which means now is the time to get into Mother's Day mode and start shopping for the best gifts to celebrate...3 days ago",https://www.cbsnews.com/essentials/best-mothers-day-gifts-at-walmart/,3 days ago
