,title,brand,descript,url,time
79,30 Mother's Day Gifts We've Tried and Love (2023),WIRED,30 Mother's Day Gift Ideas for the Superhero in Your Life · A Water Bottle That Won't Spill. Hydro Flask Wide Mouth Vacuum Bottle · A Changing Robe for...11 months ago,https://www.wired.com/gallery/best-mothers-day-gifts-2023/,11 months ago
80,Best Mother's Day gifts for wives,USA Today,3. For the one who loves a good soak: Royal Craft Luxury Bathtub Caddy Tray ... A bath is a perfect escape from the chaos. Treat her to our best-reviewed bath...11 months ago,https://www.usatoday.com/story/money/reviewed/2023/05/09/best-mothers-day-gifts-for-wives/70171785007/,11 months ago
81,40 Best Last-Minute Mother's Day Gifts 2024,The Pioneer Woman,40 Best Last-Minute Mother's Day Gifts That Are Still Thoughtful · Relaxing Spa Gift Basket · Relaxing Spa Gift Basket · Bedsure Satin Pillowcase · Bedsure...1 month ago,https://www.thepioneerwoman.com/holidays-celebrations/g35770191/last-minute-mothers-day-gifts/,1 month ago
82,40 Best First Mother's Day Gifts 2024 - Gift Ideas for New Moms,The Pioneer Woman,40 Best First Mother's Day Gifts for Any New Mom · The Giving Heart Weighted Pillow · The Giving Heart Weighted Pillow · Funny Decision Coin · Funny Decision...1 month ago,https://www.thepioneerwoman.com/holidays-celebrations/gifts/g35563494/first-mothers-day-gifts/,1 month ago
83,22 thoughtful Mother’s Day gifts from Etsy she’ll cherish forever,CNN,22 thoughtful Mother's Day gifts from Etsy she'll cherish forever · ZehrDesignCo Personalized Family Recipe Plate · LauraLynnPottery Handmade Mug With Name.11 months ago,https://www.cnn.com/cnn-underscored/gifts/etsy-mothers-day-gifts-2023,11 months ago
84,These Are the 40 Best Mother's Day Gifts to Buy Your Wife in 2024,veranda.com,40 Mother's Day Gifts That Are Guaranteed to Make Your Wife Smile · Oura Ring Gen3 · Oura Ring Gen3 · Pickleball Paddle · Pickleball Paddle · Bowen Natural...1 month ago,https://www.veranda.com/shopping/g60116609/mothers-day-gifts-for-wife/,1 month ago
85,50 Best Mother's Day Gifts on Amazon 2024,Town & Country Magazine,50 Mother's Day Gifts on Amazon Your Mom Will Cherish Dearly · Oscar de la Renta French Wallet · Oscar de la Renta French Wallet · Parlovable Plush Furry Open...2 months ago,https://www.townandcountrymag.com/style/g39187684/best-mothers-day-gifts-on-amazon/,2 months ago
86,What the Tech? A mother’s day gift to start now,KWCH,If you need a good gift...5 days ago,https://www.kwch.com/2024/04/09/what-tech-mothers-day-gift-start-now/,5 days ago
87,19 Best Mother's Day Gifts for New Moms,CNET,Celebrate her entry into motherhood with these thoughtful gifts for Mother's Day.1 week ago,https://www.cnet.com/home/mothers-day-gifts-for-new-moms/,1 week ago
88,Find the Perfect Gifts for Mother's Day at Macy's,"Macy's, Inc.","Macy's can help you find a gift that shows every Mom's unique personal style This Mother's Day, Macy's is the place to shop for a variety of gifts to...11 months ago",https://www.macysinc.com/newsroom/news/news-details/2023/Find-the-Perfect-Gifts-for-Mothers-Day-at-Macys/default.aspx,11 months ago
89,Mother's Day Gift Guide: The Best Hotel Packages For Moms,Forbes,Mother's Day Gift Guide: The Best Hotel Packages For Moms · The Rest & Renew Package at The Benjamin Royal Sonesta New York in NYC · The Historic Charmer...11 months ago,https://www.forbes.com/sites/jordilippemcgraw/2023/05/04/mothers-day-gift-guide-the-best-hotel-packages/,11 months ago
90,36 Amazon Mother’s Day gifts under $25 that we know she’ll love,CNN,36 Amazon Mother's Day gifts under $25 that we know she'll love · Chef'n Garliczoom Garlic Chopper · Zulay Handheld Milk Frother · Perilogics Universal In-...11 months ago,https://www.cnn.com/cnn-underscored/gifts/best-amazon-mothers-day-gifts,11 months ago
91,45 Best Mother's Day Gifts for Wives 2024 - Unique Gift Ideas for Wives,Men's Health,"Birthdate Personalized Pendant Necklace ... A personalized gift is always a great idea, catered to her and her only. This pendant necklace is designed around her...11 months ago",https://www.menshealth.com/technology-gear/g35796470/mothers-day-gifts-wives/,11 months ago
92,29 Last Minute Mother's Day Gifts to Save the Day in 2023,GQ,The Best Last-Minute Mother's Day Gifts Can Still Make It in Time · Where should I shop for last-minute Mother's Day gifts? · Sleepy Jones Marina pajama set.11 months ago,https://www.gq.com/gallery/last-minute-mothers-day-gifts-ideas,11 months ago
93,25 Best Mother's Day Gifts from Toddlers 2024 - Mother's Day Gifts from Kids,The Pioneer Woman,25 Best Mother's Day Gifts from Toddlers That Mom Will Treasure Forever · Mama Bear Slippers · Mama Bear Slippers · Willow Tree Tenderness Keepsake Box · Willow...1 month ago,https://www.thepioneerwoman.com/holidays-celebrations/gifts/g43496777/mothers-day-gifts-from-toddlers/,1 month ago
94,Mother's Day Gifts to Buy Yourself,Parents,"Sure, Mother's Day is not actually about getting gifts from my kids—it's about soaking in the time when they're little enough to still get excited about...11 months ago",https://www.parents.com/mothers-day-gifts-for-self-amazon-7486502,11 months ago
95,Mother's Day Gifts for a Cozy Night In—or Wild Night Out,WSJ,"Ten gifts to give Mom her dream evening, be it a bubble bath at home or dancing 'til…well, maybe not quite dawn · 1. Art and Soul. Hilma af Klint explored...11 months ago",https://www.wsj.com/articles/mothers-day-gift-guide-2023-edc72573,11 months ago
96,"Mother's Day Gift Guide 2024: Shop Flowers, Jewelry and More Early Mother's Day Gift Ideas for Mom",Entertainment Tonight,Jane Win LOVE Carved Heart Necklace with Gold Setting. There's no doubt your mom will love this carved stone heart pendant set in 10k gold and accented with...1 week ago,https://www.etonline.com/mothers-day-gift-guide-2024-shop-flowers-jewelry-and-more-early-mothers-day-gift-ideas-for-mom,1 week ago
97,The best Mother's Day gifts for new moms,Good Morning America,"We found the best Mother's Day gifts for new moms including a personalized jewelry, the best nursing pajamas and more.2 weeks ago",https://goodmorningamerica.com/shop/story/mothers-day-gifts-new-moms-108705936,2 weeks ago
98,Mother's Day 2024 gift ideas from Amazon that we found,WPTZ,"Mother's Day is coming soon, and if you're like me, you're looking for the right gift to express your thanks to the mom(s) in your life.1 week ago",https://www.mynbc5.com/article/mothers-day-gifts-amazon-2024/60396463,1 week ago
99,15 Last-Minute Mother's Day Gifts in 2023 You Can Grab Right Now,Allure,15 Last-Minute Mother's Day Gifts That'll Make Her Day · Dr. Dennis Gross Skincare DRx SpectraLite FaceWare Pro · Chanel No. · Our Place Always Pan 2.0.11 months ago,https://www.allure.com/gallery/last-minute-mothers-day-gifts-2023,11 months ago
100,25 Mother’s Day gifts for the mom obsessed with gardening,CNN,Gardening starter kits for moms · Salsa Grow Kit · ModParty Personalized Mini Herb Garden Kit · GigisGardenGifts Serenity Gardening Gift Box · Spade to Fork...11 months ago,https://www.cnn.com/cnn-underscored/gifts/mothers-day-gardening-gifts-2023,11 months ago
101,17 Stellar Mother's Day Gifts for Every Type of Mom,Bon Appétit,17 Stellar Mother's Day Gifts for Every Type of Mom · Diaspora Co. Anamalai Cacao · Le Creuset Demi Kettle · Bachan's Japanese Barbecue Sauce Set · Barebones...11 months ago,https://www.bonappetit.com/story/best-mothers-day-gifts-2023,11 months ago
102,Last-Minute Mother’s Day Gift Ideas 2024,Forbes,Best Last-Minute Mother's Day Gifts With Fast Shipping · A Tote That's Perfect For Beach Season · Aloha Collection Painted Birds Day Tripper Tote · A Dainty...11 months ago,https://www.forbes.com/sites/forbes-personal-shopper/2023/05/11/last-minute-mothers-day-gifts/,11 months ago
103,The best Mother's Day gifts for Mom in 2023 (Last chance!),CBS News,Gifts that likely won't arrive in time · Casper silk pillowcase and sleep mask set · Oura Ring Gen3 · Treat Mom to Magnolia Bakery's famous banana pudding.11 months ago,https://www.cbsnews.com/essentials/best-mothers-day-gifts-for-mom-in-2023-05-12/,11 months ago
104,The 27 Best Mother's Day Gifts of 2024 | Reviews by Wirecutter,The New York Times,"From our favorite flower delivery service to a fruit tree and meaningful jewelry, these are the top Wirecutter-approved Mother's Day gifts.1 week ago",https://www.nytimes.com/wirecutter/gifts/best-mothers-day-gifts/,1 week ago
105,Survey: Father's Day beats Mother's Day when it comes to gift-giving,Chain Store Age,"Survey: Father's Day beats Mother's Day when it comes to gift-giving · More consumers plan to celebrate Mother's Day, but that doesn't mean they will do so by...11 months ago",https://chainstoreage.com/survey-fathers-day-beats-mothers-day-when-it-comes-gift-giving,11 months ago
106,I Plan My Own Mother's Day Every Year—Here's Why,The Everymom,"Mother's Day is the one (one!) day a year moms are officially recognized. It's also a day that has become an intensely important holiday, at least in my...11 months ago",https://theeverymom.com/i-plan-my-own-mothers-day-every-year-heres-why/,11 months ago
107,The Best Mother’s Day Gift Baskets 2024,Forbes,Patet Dolce Far Niente Gift Box ... Sunny days are undoubtedly ahead with this curated gift box from Patet. It's packed with all of the essentials for a seaside...11 months ago,https://www.forbes.com/sites/forbes-personal-shopper/2023/05/04/mothers-day-gift-baskets/,11 months ago
108,11 Moms Reveal What They Want Most for Mother's Day — and It's All Available on Amazon,People,"Real moms reveal what they're hoping to get this Mother's Day. All of these Mother's Day gift ideas, including a spa-themed gift basket, an indoor garden,...11 months ago",https://people.com/lifestyle/mothers-day-gift-ideas-from-moms-amazon/,11 months ago
109,Father's Day 2023 gifts: Spending on dads lags behind Mother's Day,Axios,Consumers are expected to spend nearly 36% or $12.8 billion less on dads than they did on moms last month.9 months ago,https://www.axios.com/2023/06/18/fathers-day-gifts-2023-spending,9 months ago
110,25 Mother’s Day gifts for the mom obsessed with gardening,CNN,Gardening starter kits for moms · Salsa Grow Kit · ModParty Personalized Mini Herb Garden Kit · GigisGardenGifts Serenity Gardening Gift Box · Spade to Fork...11 months ago,https://www.cnn.com/cnn-underscored/gifts/mothers-day-gardening-gifts-2023,11 months ago
111,17 Stellar Mother's Day Gifts for Every Type of Mom,Bon Appétit,17 Stellar Mother's Day Gifts for Every Type of Mom · Diaspora Co. Anamalai Cacao · Le Creuset Demi Kettle · Bachan's Japanese Barbecue Sauce Set · Barebones...11 months ago,https://www.bonappetit.com/story/best-mothers-day-gifts-2023,11 months ago
112,Last-Minute Mother’s Day Gift Ideas 2024,Forbes,Best Last-Minute Mother's Day Gifts With Fast Shipping · A Tote That's Perfect For Beach Season · Aloha Collection Painted Birds Day Tripper Tote · A Dainty...11 months ago,https://www.forbes.com/sites/forbes-personal-shopper/2023/05/11/last-minute-mothers-day-gifts/,11 months ago
113,40 Mother’s Day Gifts for Daughters,Parade Magazine,"40 Mother's Day Gifts for Daughters · 40. Rose Gold Desk Organizer, $16.99 on Amazon · 39. Supersonic Hair Dryer, $429.99 at Dyson · 38. Pranayama Long Wrap, at...11 months ago",https://parade.com/1378569/maya-thomas/mothers-day-gifts-for-daughters/,11 months ago
114,The best Mother's Day gifts for Mom in 2023 (Last chance!),CBS News,Gifts that likely won't arrive in time · Casper silk pillowcase and sleep mask set · Oura Ring Gen3 · Treat Mom to Magnolia Bakery's famous banana pudding.11 months ago,https://www.cbsnews.com/essentials/best-mothers-day-gifts-for-mom-in-2023-05-12/,11 months ago
115,The 27 Best Mother's Day Gifts of 2024 | Reviews by Wirecutter,The New York Times,"From our favorite flower delivery service to a fruit tree and meaningful jewelry, these are the top Wirecutter-approved Mother's Day gifts.1 week ago",https://www.nytimes.com/wirecutter/gifts/best-mothers-day-gifts/,1 week ago
116,Survey: Father's Day beats Mother's Day when it comes to gift-giving,Chain Store Age,"Survey: Father's Day beats Mother's Day when it comes to gift-giving · More consumers plan to celebrate Mother's Day, but that doesn't mean they will do so by...11 months ago",https://chainstoreage.com/survey-fathers-day-beats-mothers-day-when-it-comes-gift-giving,11 months ago
117,The Best Mother’s Day Gift Baskets 2024,Forbes,Patet Dolce Far Niente Gift Box ... Sunny days are undoubtedly ahead with this curated gift box from Patet. It's packed with all of the essentials for a seaside...11 months ago,https://www.forbes.com/sites/forbes-personal-shopper/2023/05/04/mothers-day-gift-baskets/,11 months ago
118,11 Moms Reveal What They Want Most for Mother's Day — and It's All Available on Amazon,People,"Real moms reveal what they're hoping to get this Mother's Day. All of these Mother's Day gift ideas, including a spa-themed gift basket, an indoor garden,...11 months ago",https://people.com/lifestyle/mothers-day-gift-ideas-from-moms-amazon/,11 months ago
119,Father's Day 2023 gifts: Spending on dads lags behind Mother's Day,Axios,Consumers are expected to spend nearly 36% or $12.8 billion less on dads than they did on moms last month.9 months ago,https://www.axios.com/2023/06/18/fathers-day-gifts-2023-spending,9 months ago
120,40 Mother’s Day Gifts for Daughters,Parade Magazine,"40 Mother's Day Gifts for Daughters · 40. Rose Gold Desk Organizer, $16.99 on Amazon · 39. Supersonic Hair Dryer, $429.99 at Dyson · 38. Pranayama Long Wrap, at...11 months ago",https://parade.com/1378569/maya-thomas/mothers-day-gifts-for-daughters/,11 months ago
121,The best Mother's Day gifts for Mom in 2023 (Last chance!),CBS News,Gifts that likely won't arrive in time · Casper silk pillowcase and sleep mask set · Oura Ring Gen3 · Treat Mom to Magnolia Bakery's famous banana pudding.11 months ago,https://www.cbsnews.com/essentials/best-mothers-day-gifts-for-mom-in-2023-05-12/,11 months ago
122,The 27 Best Mother's Day Gifts of 2024 | Reviews by Wirecutter,The New York Times,"From our favorite flower delivery service to a fruit tree and meaningful jewelry, these are the top Wirecutter-approved Mother's Day gifts.1 week ago",https://www.nytimes.com/wirecutter/gifts/best-mothers-day-gifts/,1 week ago
123,Survey: Father's Day beats Mother's Day when it comes to gift-giving,Chain Store Age,"Survey: Father's Day beats Mother's Day when it comes to gift-giving · More consumers plan to celebrate Mother's Day, but that doesn't mean they will do so by...11 months ago",https://chainstoreage.com/survey-fathers-day-beats-mothers-day-when-it-comes-gift-giving,11 months ago
124,The Best Mother’s Day Gift Baskets 2024,Forbes,Patet Dolce Far Niente Gift Box ... Sunny days are undoubtedly ahead with this curated gift box from Patet. It's packed with all of the essentials for a seaside...11 months ago,https://www.forbes.com/sites/forbes-personal-shopper/2023/05/04/mothers-day-gift-baskets/,11 months ago
125,11 Moms Reveal What They Want Most for Mother's Day — and It's All Available on Amazon,People,"Real moms reveal what they're hoping to get this Mother's Day. All of these Mother's Day gift ideas, including a spa-themed gift basket, an indoor garden,...11 months ago",https://people.com/lifestyle/mothers-day-gift-ideas-from-moms-amazon/,11 months ago
126,"Mother's Day 2023: Record spending on gifts, meals for moms expected",Axios,"The amount we spend on gifts for mom is reaching record highs. The big picture: Consumers plan a total of $35.7 billion on Mother's Day this year, nearly $4...11 months ago",https://www.axios.com/2023/05/13/mothers-day-gifts-2023-spending,11 months ago
127,35 luxury Mother’s Day gifts that she definitely deserves,CNN,35 luxury Mother's Day gifts that she definitely deserves · Cuyana Classic Structured Leather Tote · Lunya Washable Silk Long-Sleeve Pant Set · NuFace Facial...11 months ago,https://www.cnn.com/cnn-underscored/gifts/luxury-mothers-day-gifts-2023,11 months ago
128,The O List Mother's Day Gift Guide,Oprah Daily,"In this edition of The O List, we rounded up amazing gift ideas to help you celebrate the deserving mom in your life.11 months ago",https://www.oprahdaily.com/life/g43530110/mothers-day-o-list/,11 months ago
129,Amazon Dropped a Customer-Loved Gift Guide for Mother's Day — and Prices Start at $4,People,Amazon dropped a Mother's Day gift guide that's full of customer-favorite finds starting at $4. The curation is packed with Mother's Day gift ideas across...11 months ago,https://people.com/lifestyle/customer-loved-mothers-day-gifts-amazon-2023/,11 months ago
130,21 Unique Mother's Day Gifts for Every Mom,Reader's Digest,Need some gift inspiration for all the wonderful women in your life? We rounded up the best Mother's Day gift ideas to suit every type of mom.3 days ago,https://www.rd.com/list/mothers-day-gift-ideas/,3 days ago
131,Your 2023 Dallas Mother's Day Gift Guide,D Magazine,"Your 2023 Dallas Mother's Day Gift Guide · Relax and Recharge Gift Box, $114, A Box of Dallas · Mani-Pedi Kit, $45, GlossLab · The Soothing Kit, $550, Joanna...11 months ago",https://www.dmagazine.com/shopping-fashion/2023/04/your-2023-dallas-mothers-day-gift-guide/,11 months ago
132,21 best mom-approved Mother's Day gifts in 2023,NBC News,Our top picks · Mom-approved diaper bag: Dagne Dover Indi Diaper Backpack · Mom-approved facial cleansing brush: Foreo Luna 3 · Mom-approved essential oil...11 months ago,https://www.nbcnews.com/select/shopping/mom-approved-mothers-day-gifts-ncna1304976,11 months ago
133,The 30+ Best Mother’s Day Gifts from Hollywood-Loved Brands,The Hollywood Reporter,The 30+ Best Mother's Day Gifts from Hollywood-Loved Brands · 1. Lake Pima Bundle · 2. Modern Picnic Mother's Day Gift Set · 3. Gucci Rectangular Frame...11 months ago,https://www.hollywoodreporter.com/lifestyle/shopping/best-mothers-day-gifts-4153508/,11 months ago
134,58 Best Gifts for Mom from Son 2023 - Best Mother's Day Gifts,Men's Health,"58 Best Mother's Day Gift Ideas for Sons to Buy Their Moms in 2023 · Homesick Thank You, Mom Candle · Homesick Thank You, Mom Candle · Personalized Family Print...11 months ago",https://www.menshealth.com/technology-gear/g35937168/gifts-for-mom-from-son/,11 months ago
135,59 best Mother's Day gifts of 2022,New York Post,"1. Eve's Addiction Four Birthstone Pea in a Pod Gold Bracelet, $56, original price: $80. Eve's Addiction Four...8 months ago",https://nypost.com/article/best-mothers-day-gift-ideas-2022/,8 months ago
136,The Best Mother's Day Gift Ideas in 2023,AARP,Beauty and style treats to indulge Mom with everything she wants or needs · 1. … needs a wardrobe reset · 2. ... loves fragrance · 3. … makes comfort a style...11 months ago,https://www.aarp.org/entertainment/style-trends/info-2023/mothers-day-gifts.html,11 months ago
137,Mother’s Day Travel Gift Ideas: Luxury Jet Set Mother’s Day Gift Guide,observer.com,The Best Mother's Day Gift Ideas for the Jet-Setting Mom · sky blue hardcase suitcase. Away. · Amazon Kindle. · black leather passport holder. Leatherology.11 months ago,https://observer.com/2023/04/mothers-day-travel-gift-ideas/,11 months ago
138,50 Best Mother's Day Gifts 2024: Shop Useful Gifts for Mom,House Beautiful,"50 of the Best Mother's Day Gifts That All Moms Secretly Want · McGee & Co. Xavier Serving Set, Set of 2 · McGee & Co. Xavier Serving Set, Set of 2 · FRAMA St.11 months ago",https://www.housebeautiful.com/shopping/g39357575/best-mothers-day-gifts/,11 months ago
139,33 Best Last-Minute Mother's Day Gifts of 2024 | Reviews by Wirecutter,The New York Times,The 33 Best Last-Minute Mother's Day Gifts · Blooming Lego · Shimmery earrings · A jubilant card · Sleek tresses...2 weeks ago,https://www.nytimes.com/wirecutter/gifts/last-minute-mothers-day-gifts/,2 weeks ago
140,Mother's Day Gift Guide 2024: The Coolest Lightweight Gear For Backpacking,Forbes,"For adventurous moms who love the outdoors, get them something they really want this year.2 days ago",https://www.forbes.com/sites/wendyaltschuler/2024/04/12/mothers-day-gift-guide-2024-the-coolest-lightweight-gear-for-backpacking/,2 days ago
141,How to Shop for Mother's Day: Creative Gift Ideas for Mom,Best Products,Tips for Finding Mother's Day Gifts · UncommonGoods Pollinator Garden Set · Daughterofearthart Fern Earrings · SHOKZ Open-Ear Bluetooth Bone Conduction Sport...1 month ago,https://www.bestproducts.com/lifestyle/a60127094/how-to-shop-mothers-day/,1 month ago
142,These Last Minute Mother's Day Gifts Won't Get You Disowned,The Root,"An Airbnb gift card is an easy way to give Mom the getaway she deserves. Gift cards can be used for any stay, Experience, or Online Experience on the site. You...11 months ago",https://www.theroot.com/these-last-minute-mothers-day-gifts-wont-get-you-disown-1850431631,11 months ago
143,37 best Mother's Day gifts 2023 — great ideas for every mom,Tom's Guide,37 best Mother's Day gifts 2023 — great ideas for every mom · Manduka PRO Lite Yoga Mat · Amazon Kindle (2022) · Venus Et Fleur The Classic Bundle · Apple Watch...11 months ago,https://www.tomsguide.com/deals/best-mothers-day-gifts,11 months ago
144,Mother's Day gift ideas from 1977,WTAE,"In 1977, WTAE's Lynn Hinds attempted what many before him and since have undertaken: finding the right gift for Mom on Mother's Day.11 months ago",https://www.wtae.com/article/mothers-day-gift-ideas-1977/43883324,11 months ago
145,23 last-minute Mother's Day gifts that don't require shipping,USA Today,23 last-minute Mother's Day gifts that don't require shipping · From $25 at Home Chef · From $19 per month at Allure · From $21 per month at Rocksbox · From $16...11 months ago,https://www.usatoday.com/story/money/reviewed/2023/05/09/last-minute-mothers-day-gifts-no-shipping/70199046007/,11 months ago
146,Last-minute Mother's Day gift idea: A flower delivery from UrbanStems,USA Today,The Luna flowers are a mixture of deep blues and purples with pops of bright white roses. They will look stunning on your mom's kitchen counter.11 months ago,https://www.usatoday.com/story/money/reviewed/2023/05/09/last-minute-mothers-day-gift-flowers/70200398007/,11 months ago
147,"57 Mother's Day Gifts from Daughters, Approved by Daughters 2024",Glamour,57 Mother's Day Gifts from Daughters That Are Sure to Make Her Smile · WP Porter Lunch Box 3 Compartment Bento Box Style Portable Adult Lunch Box. 55/57. W&P...3 weeks ago,https://www.glamour.com/gallery/gifts-for-mom-from-daughter,3 weeks ago
148,Mother's Day Gift Ideas | cbs8.com,cbs8.com,"Wine Oh Tv Founder and host Monique Soltani with some of her favorite wines and food pairings, along with some non-wine gift ideas as well.11 months ago",https://www.cbs8.com/video/news/local/mornings/mothers-day-gift-ideas/509-6e590132-0fdd-4968-a265-970fd5643afa,11 months ago
149,"Best Mother's Day gifts for 2024, including unique ideas for mom under $100",ABC Chicago,We've rounded up the best Mother's Day gifts for 2024 that will arrive in time.5 days ago,https://abc7chicago.com/best-mothers-day-gift-ideas-gifts-for-mom/14637875/,5 days ago
